{"$schema": "./schema.json", "instanceId": "vhs.defaults", "theme": {}, "global": {"speed": 1, "delayOffset": 0, "easing": "ease-out-cubic"}, "elements": [], "extras": {"speed": 0.5, "wave": 1, "jitter": 0.25, "crease": 0.1, "switching": 0.05, "switchingHeight": 0.02, "bloom": 0.4, "aberration": 2, "acBeat": 1, "grain": 0.1, "scanlines": 0.1, "vignette": 0, "barrel": 0, "saturation": 1, "exposure": 1, "fadeInFrames": 0, "fadeOutFrames": 0}}
